{
  "task_id": "AGENT-SAFE-004",
  "goal": "Roadmap- und Claim-Referenzen konsistent halten",
  "task_type": "governance",
  "allowed_paths": [
    "docs/roadmap.md",
    "docs/tasks/",
    "docs/claims/"
  ],
  "forbidden_paths": [
    "docs/_generated/",
    "secrets/",
    "snapshots/"
  ],
  "claims": [
    "CLAIM-AGENT-SAFE-003"
  ],
  "expected_evidence": [
    "docs/roadmap.md",
    "docs/claims/registry.yml"
  ],
  "validation_commands": [
    "python3 -m scripts.docmeta.validate_claim_registry",
    "python3 -m scripts.docmeta.validate_schema"
  ],
  "delete_allowed": false
}
